{
  "schema_version": "1.0",
  "run_id": "run-false-positive-rejection-baseline",
  "side": "baseline",
  "case_id": "false-positive-rejection",
  "fixture_manifest_sha256": "9dfff6226aa01fe81371e8a5d53b99a8ed95f4a67571ae47dcd435c3dec7a4dd",
  "target_manifest_hash": "d0d4ee1debb7246f4a946eaa0d1af811d1dc9698c022fb2289e645d02fa49554",
  "epoch_hash": "42a233a370e60568d669dc7c3543b9232914414d77650cf5dc580b1c9afc3726",
  "role_context": {
    "reviewer_context_id": "ctx-fp-baseline-reviewer",
    "respondent_context_id": "ctx-fp-baseline-respondent",
    "contexts_distinct": true,
    "joint_record_version": "joint-fp-v1",
    "reviewer_approved": true,
    "respondent_approved": true
  },
  "model_identity": { "reviewer": "legacy-reviewer-fixture", "respondent": "legacy-respondent-fixture" },
  "routing_status": "DECLARED_ONLY",
  "deterministic_checks": "PASS",
  "evidence_status": "SUFFICIENT",
  "coverage_status": "RELIABLE",
  "gate_status": "PASS",
  "proceed_status": "NOT_AUTHORIZED",
  "escalation_step": "none",
  "escalation_trace": ["none"],
  "finding_count": 0,
  "propositions": [
    { "proposition_id": "medium-fp-001", "severity": "medium", "discovery": "NOT_APPLICABLE", "rejection": "REJECTED" }
  ],
  "packet_sha256": "b59635ebcb9aab83aafe75c9a029ca9a244140e08d8ba05c31c6332bdbfdf653",
  "dispatch_receipt_sha256": "bc8b8325a2df1362839e5255edf24b73abc07068cddb622f9c4c6b9916d651c4",
  "input_tokens": 160,
  "output_tokens": 64,
  "dispatch_count": 0,
  "runtime_dispatch_attempted": false,
  "runtime_dispatch_enforcement_claimed": false
}
