{
  "schema_version": "1.0",
  "run_id": "run-unreliable-coverage-baseline",
  "side": "baseline",
  "case_id": "unreliable-coverage",
  "fixture_manifest_sha256": "9dfff6226aa01fe81371e8a5d53b99a8ed95f4a67571ae47dcd435c3dec7a4dd",
  "target_manifest_hash": "d0d4ee1debb7246f4a946eaa0d1af811d1dc9698c022fb2289e645d02fa49554",
  "epoch_hash": "42a233a370e60568d669dc7c3543b9232914414d77650cf5dc580b1c9afc3726",
  "role_context": {
    "reviewer_context_id": "ctx-unreliable-baseline-reviewer",
    "respondent_context_id": "ctx-unreliable-baseline-respondent",
    "contexts_distinct": true,
    "joint_record_version": "joint-unreliable-v1",
    "reviewer_approved": false,
    "respondent_approved": false
  },
  "model_identity": { "reviewer": "legacy-reviewer-fixture", "respondent": "legacy-respondent-fixture" },
  "routing_status": "DECLARED_ONLY",
  "deterministic_checks": "PASS",
  "evidence_status": "SUFFICIENT",
  "coverage_status": "UNRELIABLE",
  "gate_status": "BLOCKED",
  "proceed_status": "NOT_AUTHORIZED",
  "escalation_step": "eligibility",
  "escalation_trace": ["eligibility"],
  "finding_count": 1,
  "propositions": [
    { "proposition_id": "high-coverage-001", "severity": "high", "discovery": "FOUND", "rejection": "NOT_APPLICABLE" }
  ],
  "packet_sha256": "83145c2da960d8cfea93ebf15d378bb3a862e030667f0ec788396941dcbd31e4",
  "dispatch_receipt_sha256": "fd3e0cb7ec4640a1cedc67ecada5e9adcccefeabd852c4a40f4c8167ad673f98",
  "input_tokens": 130,
  "output_tokens": 50,
  "dispatch_count": 0,
  "runtime_dispatch_attempted": false,
  "runtime_dispatch_enforcement_claimed": false
}
