{
  "schema_version": "1.0",
  "run_id": "run-zero-findings-baseline",
  "side": "baseline",
  "case_id": "zero-findings",
  "fixture_manifest_sha256": "9dfff6226aa01fe81371e8a5d53b99a8ed95f4a67571ae47dcd435c3dec7a4dd",
  "target_manifest_hash": "d0d4ee1debb7246f4a946eaa0d1af811d1dc9698c022fb2289e645d02fa49554",
  "epoch_hash": "42a233a370e60568d669dc7c3543b9232914414d77650cf5dc580b1c9afc3726",
  "role_context": {
    "reviewer_context_id": "ctx-zero-baseline-reviewer",
    "respondent_context_id": "ctx-zero-baseline-respondent",
    "contexts_distinct": true,
    "joint_record_version": "joint-zero-v1",
    "reviewer_approved": true,
    "respondent_approved": true
  },
  "model_identity": { "reviewer": "legacy-reviewer-fixture", "respondent": "legacy-respondent-fixture" },
  "routing_status": "DECLARED_ONLY",
  "deterministic_checks": "PASS",
  "evidence_status": "SUFFICIENT",
  "coverage_status": "RELIABLE",
  "gate_status": "PASS",
  "proceed_status": "NOT_AUTHORIZED",
  "escalation_step": "none",
  "escalation_trace": ["none"],
  "finding_count": 0,
  "propositions": [],
  "packet_sha256": "216aaa4caa7c4293c97efb6bf67344bd0a7696ee7053f59ec3697a3223d8138d",
  "dispatch_receipt_sha256": "15ac63ace8f091bf514a6afa9a4648ac011e945f294d251d24e5180618b38bac",
  "joint_record_sha256": "ec6f9491445164c85fa87f0ec37ed796e37f7c539feeb61cb64af7500ad55003",
  "input_tokens": 120,
  "output_tokens": 40,
  "dispatch_count": 0,
  "runtime_dispatch_attempted": false,
  "runtime_dispatch_enforcement_claimed": false
}
